{
  "bodyTypeName": "male",
  "url": "http://localhost/#?body=Body_color_black&head=Human_male_black&hair=Afro_black&facial=Facial_sunglasses&clothes=Shortsleeve_pink&legs=Pants_blue&shoes=Shoes_black&nose=Straight_nose_black",
  "spritesheets": "http://localhost/spritesheets/",
  "version": 1,
  "datetime": "12/27/2023, 6:09:14 AM",
  "credits": "Authors: bluecarrot16, Benjamin K. Smith (BenCreating), Evert, Eliza Wyatt (ElizaWy), TheraHedwig, MuffinElZangano, Durrani, Johannes Sj?lund (wulax), Stephen Challener (Redshrike), Thane Brimhall (pennomi), Matthew Krohn (makrohn), Michael Whitlock (bigbeargames), ElizaWy, David Conway Jr. (JaidynReiman), Joe White, Johannes Sjölund (wulax)\n\n- body/bodies/male/universal/black.png: by bluecarrot16, Benjamin K. Smith (BenCreating), Evert, Eliza Wyatt (ElizaWy), TheraHedwig, MuffinElZangano, Durrani, Johannes Sj?lund (wulax), Stephen Challener (Redshrike). License(s): CC-BY-SA 3.0, GPL 3.0. \n    - https://opengameart.org/content/liberated-pixel-cup-lpc-base-assets-sprites-map-tiles\n    - https://opengameart.org/content/lpc-medieval-fantasy-character-sprites\n    - https://opengameart.org/content/lpc-male-jumping-animation-by-durrani\n    - https://opengameart.org/content/lpc-runcycle-and-diagonal-walkcycle\n    - https://opengameart.org/content/lpc-revised-character-basics\n\n- head/heads/human_male/universal/black.png: by bluecarrot16, Benjamin K. Smith (BenCreating), Stephen Challener (Redshrike). License(s): OGA-BY 3.0, CC-BY-SA 3.0, GPL 3.0. \n    - https://opengameart.org/content/liberated-pixel-cup-lpc-base-assets-sprites-map-tiles\n    - https://opengameart.org/content/lpc-character-bases\n\n- head/nose/straight/black.png: by Thane Brimhall (pennomi), Matthew Krohn (makrohn). License(s): GPL 3.0, CC-BY-SA 3.0. \n    - https://opengameart.org/content/lpc-base-character-expressions\n\n- hair/afro/male/black.png: by bluecarrot16. License(s): CC0. \n    - https://opengameart.org/content/lpc-hair\n\n- facial/sunglasses.png: by Michael Whitlock (bigbeargames), Thane Brimhall (pennomi). License(s): CC-BY-SA 3.0, GPL 3.0. \n    - https://opengameart.org/content/lpc-base-character-expressions\n\n- torso/clothes/shortsleeve/male/pink.png: by bluecarrot16, ElizaWy, Stephen Challener (Redshrike). License(s): OGA-BY 3.0, CC-BY-SA 3.0, GPL 3.0. \n    - https://opengameart.org/content/liberated-pixel-cup-lpc-base-assets-sprites-map-tiles\n    - http://opengameart.org/content/lpc-revised-character-basics\n    - http://opengameart.org/content/lpc-clothing-updates\n\n- legs/pants/male/blue.png: by bluecarrot16, David Conway Jr. (JaidynReiman), Joe White, Matthew Krohn (makrohn), Johannes Sjölund (wulax). License(s): CC-BY-SA 3.0, GPL 3.0. \n    - https://opengameart.org/content/liberated-pixel-cup-lpc-base-assets-sprites-map-tiles\n    - https://opengameart.org/content/lpc-medieval-fantasy-character-sprites\n\n- feet/shoes/male/black.png: by bluecarrot16, Johannes Sjölund (wulax). License(s): CC-BY-SA 3.0, GPL 3.0. \n    - https://opengameart.org/content/lpc-medieval-fantasy-character-sprites\n    - http://opengameart.org/content/lpc-clothing-updates",
  "layers": [
    {
      "fileName": "body/bodies/male/universal/black.png",
      "zPos": 10,
      "parentName": "body",
      "name": "Body color",
      "variant": "black"
    },
    {
      "fileName": "feet/shoes/male/black.png",
      "zPos": 15,
      "parentName": "shoes",
      "name": "Shoes",
      "variant": "black"
    },
    {
      "fileName": "legs/pants/male/blue.png",
      "zPos": 20,
      "parentName": "legs",
      "name": "Pants",
      "variant": "blue"
    },
    {
      "fileName": "torso/clothes/shortsleeve/male/pink.png",
      "zPos": 35,
      "parentName": "clothes",
      "name": "Shortsleeve",
      "variant": "pink"
    },
    {
      "fileName": "head/heads/human_male/universal/black.png",
      "zPos": 100,
      "parentName": "head",
      "name": "Human male",
      "variant": "black"
    },
    {
      "fileName": "head/nose/straight/black.png",
      "zPos": 105,
      "parentName": "nose",
      "name": "Straight nose",
      "variant": "black"
    },
    {
      "fileName": "facial/sunglasses.png",
      "zPos": 115,
      "parentName": "facial",
      "name": "Facial",
      "variant": "sunglasses"
    },
    {
      "fileName": "hair/afro/male/black.png",
      "zPos": 120,
      "parentName": "hair",
      "name": "Afro",
      "variant": "black"
    }
  ]
}
